{
	"$schema": "../schemas/talks.json",
	"title": "Hacking SvelteLab",
	"event": "Svelte Summit Spring 2023",
	"watch": "https://youtube.com/watch?v=UKZDcDNAHXY",
	"date": "2023-05-25",
	"description": "Presentation of Sveltelab, the supercharged REPL for sveltekit, winner of the Svelte Hackaton 2023"
}
