{
	"$schema": "../schemas/talks.json",
	"title": "Herd your async tasks!",
	"event": "Svelte London Meetup",
	"watch": "https://youtube.com/watch?v=mxM208nCvHc",
	"slides": "https://sheepdog.ricciuti.app",
	"date": "2024-10-30",
	"description": "Asynchronous code is a PITA but it doesn't have to be...follow along to learn about how a sheepdog can help you herd and juggle all your async tasks!"
}
